{
  "meta": {
    "title": "Historical Geostrategic Atlas pilot",
    "historical_start": 1861,
    "historical_end": 1992,
    "default_year": 1942,
    "default_mineral": "tin",
    "orientation_geometry": "Natural Earth 1:110m modern generalized country geometry",
    "orientation_url": "https://www.naturalearthdata.com/downloads/110m-cultural-vectors/110m-admin-0-countries/",
    "orientation_license": "Public domain",
    "orientation_caveat": "Modern generalized geometry is used only for spatial orientation. Historical names and status come from dated project records; historical borders are not yet reconstructed."
  },
  "layers": [
    {
      "id": "frus-activity",
      "title": "FRUS activity",
      "short_title": "FRUS",
      "availability": "supported",
      "geometry": "country-fill",
      "value_semantics": "Linked pilot FRUS records whose volume span includes the selected year.",
      "source_ids": [
        "frus-history-at-state",
        "frus-subject-index"
      ],
      "caveat": "Record count measures indexed documentary coverage, not diplomatic importance or policy intensity."
    },
    {
      "id": "access-relationships",
      "title": "Documented access relationships",
      "short_title": "Access",
      "availability": "supported",
      "geometry": "relationship-lines",
      "value_semantics": "Lines connect the United States to a country named in a linked negotiation, agreement, or FRUS pathway.",
      "source_ids": [
        "frus-history-at-state",
        "frus-subject-index"
      ],
      "caveat": "Line width represents linked pilot records, not shipment volume, import dependence, or strategic importance."
    },
    {
      "id": "agreements",
      "title": "Treaties and policy instruments",
      "short_title": "Instruments",
      "availability": "supported",
      "geometry": "country-markers",
      "value_semantics": "Dated or FRUS-volume-dated pilot agreements and policy instruments linked to a country.",
      "source_ids": [
        "frus-history-at-state",
        "frus-subject-index",
        "state-treaties"
      ],
      "caveat": "A marker does not imply that the record is a formal treaty. Record type and date precision remain visible."
    },
    {
      "id": "stockpile-policy",
      "title": "Strategic stockpile policy",
      "short_title": "Stockpile",
      "availability": "supported",
      "geometry": "policy-markers",
      "value_semantics": "Pilot stockpile planning episodes and statutory pathways located at country-level U.S. geography.",
      "source_ids": [
        "frus-history-at-state",
        "govinfo-statutes",
        "gsa-stockpile"
      ],
      "caveat": "Markers represent policy geography, not storage sites, holdings, acquisitions, or releases."
    },
    {
      "id": "historical-events",
      "title": "Historical episodes",
      "short_title": "Episodes",
      "availability": "supported",
      "geometry": "country-outline",
      "value_semantics": "Countries linked to a pilot historical episode during its documented date range.",
      "source_ids": [
        "frus-history-at-state",
        "frus-subject-index",
        "govinfo-statutes"
      ],
      "caveat": "Episode coverage is selective and does not define the full geography of a war or crisis."
    },
    {
      "id": "nara-discovery",
      "title": "NARA archival discovery",
      "short_title": "NARA",
      "availability": "supported",
      "geometry": "country-markers",
      "value_semantics": "Structured NARA Catalog query plans that include the selected country, mineral, and year.",
      "source_ids": [
        "nara-catalog-api"
      ],
      "caveat": "Query plans are archival leads. They are not reviewed catalog results and the site stores no API response content."
    },
    {
      "id": "resource-geography",
      "title": "Resource geography",
      "short_title": "Resources",
      "availability": "supported",
      "geometry": "country-markers",
      "value_semantics": "Country-level resource associations distinguish profile context from year-linked evidence.",
      "source_ids": [
        "frus-history-at-state",
        "usgs-statistical-compendium"
      ],
      "caveat": "Profile context is not proof that a country produced or supplied the material in the selected year. Neither class measures production, reserves, mines, supplier rank, or U.S. dependence."
    },
    {
      "id": "mineral-production",
      "title": "Mineral production",
      "short_title": "Production",
      "availability": "locked",
      "geometry": "country-fill",
      "required_data": "Country, mineral, year, mine or refined basis, value, unit, official table/page, and source URL.",
      "source_ids": [
        "usgs-statistical-compendium"
      ],
      "caveat": "The checked-in USGS pilot contains U.S. and world totals, not a compatible country-by-year production series."
    },
    {
      "id": "import-dependence",
      "title": "U.S. import supplier share",
      "short_title": "Import share",
      "availability": "locked",
      "geometry": "country-fill",
      "required_data": "Country, mineral, year, import definition, quantity or value, denominator, unit, classification, and official citation.",
      "source_ids": [
        "census-historical-trade"
      ],
      "caveat": "No country-supplier share is calculated from the current aggregate import series."
    },
    {
      "id": "quantitative-trade-flows",
      "title": "Partner trade, 1962-1992",
      "short_title": "Partner trade",
      "availability": "supported",
      "geometry": "country-fill-and-lines",
      "value_semantics": "For 1962-1988, shading and line width represent U.S.-reported UN Comtrade import value across selected SITC headings. For 1989-1992, the map uses USITC DataWeb import customs value across selected HS6 headings. Exports remain in the evidence table.",
      "source_ids": [
        "un-comtrade",
        "usitc-dataweb"
      ],
      "caveat": "Comtrade SITC revisions and product stages remain separate from DataWeb HS6 headings. Partner means reported trade partner, not mine origin, ownership, route, end use, import dependence, or strategic importance. Country positions are generalized centroids."
    },
    {
      "id": "infrastructure",
      "title": "Mines, smelters, ports, and routes",
      "short_title": "Infrastructure",
      "availability": "locked",
      "geometry": "site-and-line-features",
      "required_data": "Feature name, type, active dates, coordinates or geometry, precision, ownership/status where relevant, and official citation.",
      "source_ids": [
        "nara-catalog-api",
        "usgs-statistical-compendium"
      ],
      "caveat": "Country centroids are never presented as facility or route coordinates."
    },
    {
      "id": "alliances-boundaries",
      "title": "Alliances and historical boundaries",
      "short_title": "Alliances",
      "availability": "locked",
      "geometry": "dated-polygons",
      "required_data": "Year-bounded membership and historically reviewed boundary geometry with source and territorial-status notes.",
      "source_ids": [
        "frus-history-at-state"
      ],
      "caveat": "The orientation basemap uses modern generalized geometry and is not evidence for historical borders or alliance membership."
    },
    {
      "id": "strategic-risk",
      "title": "Strategic risk",
      "short_title": "Risk",
      "availability": "locked",
      "geometry": "country-fill",
      "required_data": "Published methodology plus sourced supplier concentration, import dependence, substitution, stockpile, and disruption variables for a common year.",
      "source_ids": [
        "usgs-ds140",
        "census-historical-trade",
        "gsa-stockpile"
      ],
      "caveat": "The portal does not convert record counts or editorial judgments into a quantitative vulnerability score."
    }
  ],
  "countries": [
    {
      "id": "united-states",
      "a3": "USA",
      "coordinates": [
        -97.0,
        38.0
      ],
      "precision": "country",
      "names_by_period": [
        {
          "name": "United States",
          "start": 1861,
          "end": 1992
        }
      ],
      "mineral_ids": [
        "aluminum",
        "bauxite",
        "chromium",
        "cobalt",
        "copper",
        "manganese",
        "rare-earth-elements",
        "tin",
        "tungsten",
        "uranium"
      ],
      "frus_document_ids": [
        "frus-1914supp-d423",
        "frus-1914supp-d427",
        "frus-1925v02-d327",
        "frus-1925v02-d344",
        "frus-1939v01-d934",
        "frus-1939v01-d939",
        "frus-1941v02-d805",
        "frus-1941v02-d821",
        "frus-1941v03-d1006",
        "frus-1941v03-d1038",
        "frus-1942v02-d3",
        "frus-1942v02-d14",
        "frus-1942v05-d493",
        "frus-1942v01-d440",
        "frus-1942v05-d564",
        "frus-1944v02-d886",
        "frus-1947v01-d395",
        "frus-1947v01-d431",
        "frus-1949v01-d204",
        "frus-1950v01-d95",
        "frus-1950v01-d167",
        "frus-1950v01-d200",
        "frus-1951v01-d242",
        "frus-1952-54v11p1-d27",
        "frus-1964-68v09-d344",
        "frus-1969-76v21-d250",
        "frus-1969-76v21-d256",
        "frus-1969-76v21-d261",
        "frus-1969-76ve16-d87",
        "frus-1964-68v26-d138",
        "frus-1964-68v26-d142",
        "frus-1964-68v26-d148"
      ],
      "agreement_ids": [],
      "episode_ids": [
        "world-war-i-resource-access",
        "interwar-planning",
        "world-war-ii-procurement",
        "early-cold-war-mobilization",
        "decolonization-and-resource-access",
        "late-cold-war-resource-policy"
      ],
      "source_ids": [
        "frus-history-at-state",
        "usgs-ds140"
      ]
    },
    {
      "id": "bolivia",
      "a3": "BOL",
      "coordinates": [
        -63.6,
        -16.3
      ],